"ID","Name","Livvi.Karelian","Source","Example","Comment"
"UT001","Is there a distinct category of dual for verbal agreement with a dual subject?",0,"Ilja Moshnikov","",""
"UT002","Is non-agreement in number between the nominal subject and verbal predicate possible?",0,"Ilja Moshnikov","","In 3Pl forms, the impersonal form is used."
"UT003","Can finite verbs agree in number with the nominal object?",0,"Ilja Moshnikov","",""
"UT004","Can an adnominal property word agree with the noun in case?",1,"Ilja Moshnikov","suure-s järve-s;big-INE lake-INE;in a big lake;
",""
"UT005","Are there cases that do not show agreement in terms of case?",1,"Ilja Moshnikov","oma-n lapse-nke;own-GEN child-COM;with one's child;",""
"UT006","Can adpositions be used to mark core verbal arguments?",0,"Ilja Moshnikov","",""
"UT007","Can adpositions be used to mark non-core/oblique verbal arguments?",1,"Ilja Moshnikov","Myö juoks-i-mmo silla-n alle;we run-PST-1PL bridge-GEN under;We ran under the bridge;Markianova 2002",""
"UT008","Can non-finite clauses entail a special way for a core argument (S/A) marking?",1,"Ilja Moshnikov","Muama-n kodi-h tul-duu rube-i-mmo yhtes pasta-ma-h;mother-GEN home-ILL come-PASS.PST.PTCP.PRT start-PST-1PL together bake-SUP-ILL;When mother came home we started to bake together;",""
"UT009","Can non-finite clauses entail a special way for a core argument (P) marking?",0,"Ilja Moshnikov","",""
"UT010","Do characteristics of object referent (topicality, animacy, definiteness) influence object marking?",0,"Ilja Moshnikov","",""
"UT011","Does object marking correlate with aspectuality? ",1,"Ilja Moshnikov","Muamo lämmit-ti päči-n;mother heat-PST.3SG oven-GEN;Mother heated up the oven;Markianova 2002|Muamo lämmit-ti päčči-i;mother heat-PST.3SG oven-PRT;Mother was heating the oven;Markianova 2002
",""
"UT012","Does the marking of the object depend on the verb conjugation form? ",1,"Ilja Moshnikov","Ota avain!;take.IMP.2SG key.NOM;Take the key!;| Älä ota avain-du!;NEG.IMP.2SG take.IMP key-PRT;Don't take the key!;",""
"UT013","Is there differential subject marking?",1,"Ilja Moshnikov","Leiby on stola-l;bread.NOM be.3SG table-ADE;The bread is on the table;Markianova 2002|Stola-l on leibi-ä;table-ADE be.3SG bread-PRT;There is some bread on the table;Markianova 2002",""
"UT014","Can S and A be conflated morphologically across clause boundaries, i.e. act as syntactic pivot?",1,"Ilja Moshnikov","Tyttö näg-i mečä-s kondie-n da juoks-i iäres;girl.NOM see-PST.3SG forest-INE bear-GEN and run-PST.3SG away;The girl saw a bear in the forest and run away; ",""
"UT015","Can S and P be conflated morphologically across clause boundaries, i.e. act as syntactic pivot?",0,"Ilja Moshnikov","",""
"UT016","Is there a grammatical device for habituality?",0,"Ilja Moshnikov","",""
"UT017","Is there a grammatical device for frequentative?",1,"Ilja Moshnikov","juos-ta;run-INF;to run;|juokse-ndele-n;run-FRQ-1SG;I run around;",""
"UT018","Is there a grammatical device for progressivity?",1,"Ilja Moshnikov","Ole-n kaččo-mas televiizoru-a;be-1SG watch-SUP.INE televizion-PRT;I am watching the TV;",""
"UT019","Is it common to use a verb in the present tense for future time reference? ",1,"Ilja Moshnikov","lähte-n Suome-h, osta-n piirua-du;go-1SG Finland-ILL buy-1SG pie-PRT;I'll go to Finland and buy a pie;",""
"UT020","Is there a grammatical device for immediate future?",1,"Ilja Moshnikov","Ole-n lähte-mäs piha-le;be-1SG go-SUP.INE yard-ALL;I am going to the yard;",""
"UT021","Is there a grammatical device for pluperfect?",1,"Ilja Moshnikov","Konzu havaču-i-n, ol-dih muu-t jo lähtie-tty muarja-h;when wake_up-PST-1SG be-IPS.PST other-PL already go-PASS.PST.PTCP berry-ILL;When I woke up, others had already left to pick berries;",""
"UT022","Can aspect be expressed overtly on the negative marker?",0,"Ilja Moshnikov","",""
"UT023","Can tense be expressed overtly on the negative marker?",0,"Ilja Moshnikov","",""
"UT024","Is there grammatical marking of mirativity?",0,"Ilja Moshnikov","",""
"UT025","Is there morphological marking on the verb dedicated to the expression of desire or wish?",0,"Ilja Moshnikov","",""
"UT026","Is there morphological marking for irrealis (e.g. hypothetical state of affairs)?",1,"Ilja Moshnikov","Elä-zi-n kylä-s, gu vai sua-zi-n;live-COND-1SG village-INE, if only get-COND-1SG;I would live in a village if I only could;",""
"UT027","Are verbs marked in a specific mood in counterfactual conditional clauses?",1,"Ilja Moshnikov","Gu ol-izi-t pasta-nuh piirua-n, syö-zi-n se-n;if be-COND-2SG bake-ACT.PST.PTCP pie-GEN eat-COND-1SG it-GEN;If  you would have baked a pie, I would eat it;",""
"UT028","Is there morphological marking on the verb dedicated to the expression of deontic necessity?",0,"Ilja Moshnikov","",""
"UT029","Is there morphological marking on the verb dedicated to the expression of epistemic possibility? ",1,"Ilja Moshnikov","anda-ne-n, tul-le-n;give-POT-1SG come-POT-1SG;I probably give, come;",""
"UT030","Is there morphological marking on the verb dedicated to the expression of deontic possibility? ",0,"Ilja Moshnikov","",""
"UT031","Is there morphological marking on the verb used to express indirect commands/wishes etc. directed to the 3Sg?",1,"Ilja Moshnikov","anda-kkah;give-IMP.3PL;Let him/her give;",""
"UT032","Is there morphological marking on the verb used to express indirect commands/wishes etc. directed to the 1Sg?",0,"Ilja Moshnikov","",""
"UT033","Is it common to use the imperative/jussive in complement clauses introduced by predicates expressing wish/desire/will? ",0,"Ilja Moshnikov","",""
"UT034","Is there morphological marking on the verb dedicated to the expression of apprehension?",0,"Ilja Moshnikov","",""
"UT035","Is there reflexive conjugation?",1,"Ilja Moshnikov","ota-mmos, ota-ttos;take-REFL.1SG, take-REFL.2SG;;Markianova 2002","Verbs have a separate reflexive paradigm."
"UT036","Are there syntactically ditransitive verbs?",0,"Ilja Moshnikov","",""
"UT037","Can non-singular 2nd and 3rd person have the same person/number marking or morphosyntactic treatment?",0,"Ilja Moshnikov","",""
"UT038","Can an impersonal (or passive) form be used instead of a finite plural form with an overt subject expression?",1,"Ilja Moshnikov","Hyö rua-tah;they work.IPS.PRS;They work;
",""
"UT039","Can third person plural verb forms be used for impersonal reference?",0,"Ilja Moshnikov","",""
"UT040","Can second person singular verb forms be used in generic meaning?",1,"Ilja Moshnikov","Tahto-ne-t hyvin eli-ä, pidä-y äijy ruadu-a;want-POT-2SG well live-INF need-3SG much work-INF;If you want to live well you need to work much;",""
"UT042","Are clauses with only infinitive predicates possible?",0,"Ilja Moshnikov","",""
"UT043","Can verbs in purposive subordinate clauses be in bare infinitive form?",1,"Ilja Moshnikov","Halgu-o ei ole perti-s päčči-e lämmit-tiä;wood_log-PRT NEG be.CNG house-INE stove-PRT heat-INF;In the house there is no wood to heat the stove;Markianova 2002",""
"UT044","Are there sentences without overt verbal arguments (e.g. weather verbs)?",1,"Ilja Moshnikov","Vihmu-u;rain-3SG;It is raning;",""
"UT045","Is copula needed for predicate nominals in the 3rd person form of the present tense?",1,"Ilja Moshnikov","Häi on čoma;s/he be.3SG beautiful;She is beautiful;",""
"UT046","Is a copula needed for predicate nominals in the past and/or future tense?",1,"Ilja Moshnikov","Häi ol-i čoma;s/he be-PST.3SG beautiful;She was beautiful;",""
"UT047","Can locative adverbial phrases act as predicates without a copula?",0,"Ilja Moshnikov","",""
"UT048","Can the same coordinating conjunction be used for NPs, VPs, and clauses? ",1,"Ilja Moshnikov","","The respective coordinating conjunction is da 'and'."
"UT049","Does existential negation have a separate operator?",0,"Ilja Moshnikov","",""
"UT050","Can standard negation be asymmetric in the present tense?",1,"Ilja Moshnikov","minä ellendä-n :  minä e-n ellendä;I understand-1SG : NEG-1SG understand.CNG;I understand : I don't understand;",""
"UT051","Can non-finite dependent clauses use the standard negation construction?",0,"Ilja Moshnikov","",""
"UT052","Is there a special negator that combines with non-finite forms?",0,"Ilja Moshnikov","",""
"UT053","Are there special negative non-finite forms?",1,"Ilja Moshnikov","Lähti iäre sanu-a sano-ma-ttah;go.PST.3SG away word-PRT say-SUP-ABE;S/he went away without saying a word;Markianova 2002",""
"UT054","Is there an impersonal passive construction?",1,"Ilja Moshnikov","Tiä ele-täh hyvin;here live-IPS.PRS well;Here (people) live well;",""
"UT055","Are there nonfinite forms specialized on the relativization of particular core participants, e.g. subjects (S/A), direct objects (P), absolutive participants (S/P)?",1,"Ilja Moshnikov","lug-ii poigu;read-ACT.PRS.PTCP boy;a reading boy;|lugie-ttu kniigu;read-PASS.PST.PTCP book;a book that has been read;",""
"UT056","Are there nonfinite forms that can relativize at least all core participants (S/A/P) and possibly also some noncore participants, e.g. locative adverbials, instruments, etc.?",0,"Ilja Moshnikov","",""
"UT057","Are there nonfinite forms that can relativize at least some noncore participants, e.g. locative adverbials or instruments, but cannot relativize all or some of the core participants, e.g. subjects?",0,"Ilja Moshnikov","",""
"UT058","Is there a specialized negative participial form, which cannot be analyzed as a specific participial marker + negation marker?",0,"Ilja Moshnikov","",""
"UT059","Is there a future participle?",0,"Ilja Moshnikov","",""
"UT060","Are there participles that can encode their subject by possessive suffixes?",0,"Ilja Moshnikov","",""
"UT061","Can subject in at least some participial subordinate clauses be encoded in the same way as in independent clauses?",0,"Ilja Moshnikov","",""
"UT062","Are there participles that obligatorily agree with the nouns they modify in case and number (in all contexts)?",1,"Ilja Moshnikov","pala-nuo-s mečä-s;burn- forest-INE;in a burned forest;",""
"UT063","Are there nonfinite forms that can be used both as participles and action nominalizations?",0,"Ilja Moshnikov","",""
"UT064","Are there nonfinite forms that can be used both as participles and agentive nominalizations?",1,"Ilja Moshnikov","opasta-i;teach-NMLZ;teacher, teaching;",""
"UT065","Are there nonfinite forms that can be used both as participles and converbs without any additional morphological material, such as case markers?",0,"Ilja Moshnikov","",""
"UT066","Is OV the neutral order in affirmative imperative clauses?",0,"Ilja Moshnikov","Kirjuta kirjaine sizäre-lle-s;write.IMP.2SG letter sister-ALL-POSS.2SG;Write a letter to your sister!;Markianova 2002","The neutral word order is VO."
"UT067","Is it possible to place an object between the negative marker and the main verb in imperative constructions? ",1,"Ilja Moshnikov","Älä tä-dä kniigu-a luve;NEG.IMP.2SG this-PRT book-PRT read.CNG;Don't read this book [read another one]!;
","It is possible only if the object is stressed/in focus, e.g. "
"UT068","Are there preverbs?",0,"Ilja Moshnikov","",""
"UT069","Are there verbal prefixes?",0,"Ilja Moshnikov","",""
"UT070","Is there diminutive (hypocoristic) marking on verbs?",0,"Ilja Moshnikov","",""
"UT071","Can modifiers of action nominalization in agent and patient roles both be marked like possessors?",1,"Ilja Moshnikov","tytö-n peze-mine/peze-ndy kest-i čuasu-n;girl-GEN wash-NMLZ take-PST.3SG hour-GEN;washing the girl, the washing done by the girl took an hour;",""
"UT072","Can the modifier of action nominalization in patient role (e.g. ""drinking of coffee"") be marked like the direct object?",1,"Ilja Moshnikov","runo-n kirjuta-ndu/kirjuta-mine;poem-GEN write-NMLZ;the poem writing;|kirjuta-n runo-n;write-1SG poem-GEN;I'll write a poem;",""
"UT073","Do core adjectives agree with the subject noun in number in the predicative position?",1,"Ilja Moshnikov","Päivä-t ol-lah pit-kät;day-PL be-IPS.PRS long-PL;The days are long;",""
"UT074","Is it possible to form synthetic superlative?",1,"Ilja Moshnikov","korge-vin puu;tall-SPRL tree;the tallest tree;",""
"UT075","Can adpositions have person/number marking?",0,"Ilja Moshnikov","","The possessive suffixes are only used in a limited context (e.g. with kinship terms)."
"UT076","Are there separate adpositions to express goal, source, and location (without there being syncretism)?",1,"Ilja Moshnikov","","The postposition expressing 'under' differs for goal, location, and source: alle (under.ALL), al (under.ADE), alpäi (under.ABL)."
"UT077","Is case compounding possible?",0,"Ilja Moshnikov","","Although it is possible to add -päi in certain cases (e.g. školalpäi), such examples are not included here as -päi is no case marker on its own."
"UT078","Are there case categories only found in pronouns?",0,"Ilja Moshnikov","",""
"UT079","Does the numeral modification of a noun have an effect on its case selection? ",1,"Ilja Moshnikov","yksi lapsi : viizi lastu;one.NOM child.NOM :  five.NOM  child.PRT;one child : five children;",""
"UT080","Is the singular form of the noun also used with numerals bigger than 1?",1,"Ilja Moshnikov","yksi lapsi : viizi lastu;one.NOM child.NOM.SG :  five.NOM  child.PRT.SG;one child : five children;",""
"UT081","Is there a genitive case that has an affix?",1,"Ilja Moshnikov","tuata-n kodi;father-GEN home;father's home;",""
"UT082","Is there a dative case used to express indirect object/receiver/goal (different from a local case)?",0,"Ilja Moshnikov","",""
"UT083","Is there a terminative case?",0,"Ilja Moshnikov","","A postpositional construction is used instead."
"UT084","Is there a separate case to indicate without what/who an action takes place / does not take place?",1,"Ilja Moshnikov","denga-ttah;money-ABE;without money;",""
"UT085","Is there a separate case to mark the motion along or by the referent of the noun (prolative)?",1,"Ilja Moshnikov","Myö tul-i-mmo kodi-h mečä-či;we come-PST-1PL home-ILL forest-PROL;We came home through/via the forest;Markianova 2002",""
"UT086","Is there a locative case that marks goal?",1,"Ilja Moshnikov","Lapse-t mennä-h škola-h;child-PL go-IPS.PRS school-ILL;The children are going to school;Markianova 2002",""
"UT087","Is there a locative case that marks location?",0,"Ilja Moshnikov","","Location and source are marked the same way."
"UT088","Is there a locative case that marks source?",1,"Ilja Moshnikov","Nosta takki lattie-lpäi;take_up.IMP.2SG jacket floor-ABL;Take the jacket up from the floor;","In addition to the suffix -l also -lpäi may be used."
"UT089","Is there case syncretism of goal and location marking?",0,"Ilja Moshnikov","",""
"UT090","Is there case syncretism of location and source marking?",1,"Ilja Moshnikov","lattie-l;floor-ALL/ADE;on the floor, from the floor;",""
"UT091","Are there two sets of local cases?",1,"Ilja Moshnikov","","There are external and internal local cases."
"UT092","Is there a third set of local cases?",0,"Ilja Moshnikov","",""
"UT093","Is there a separate case for marking the means by which something is carried out (instrumental) and/or accompaniement (comitative)?",1,"Ilja Moshnikov","Egläi velle-nke ol-i-mmo siene-s;yesterday brother-COM be-PST-1PL muschroom-INE;Yesterday, together with brother, we were picking musrooms;Markianova 2002",""
"UT094","Is there a separate case for marking accompaniment, which is different from the instrumental?",0,"Ilja Moshnikov","",""
"UT095","Is there a separate case for marking the result of change (translative) and/or a state of being (essive)?",1,"Ilja Moshnikov","Se naine jä-i leske-kse;this woman remain-PST.3SG widow-TRA;This woman became a widow;Markianova 2002",""
"UT096","Is there a separate case for marking the state of being (essive), which is different from the translative?",1,"Ilja Moshnikov","Sizär ruada-u opastaja-nnu;sister work-3SG teacher-ESS;[My] sister is working as a teacher;Markianova 2002",""
"UT097","Is there a separate morphological marker for expressing equative meaning?",0,"Ilja Moshnikov","",""
"UT098","Is there an inflectional nominal marker for expressing benefactive or destinative semantics independent from the dative?",0,"Ilja Moshnikov","",""
"UT099","Is there in addition to the basic declension a declension different from a possessive declension? ",0,"Ilja Moshnikov","",""
"UT100","Is it possible to use singular with paired body parts/clothing/accessories that accompany them?",0,"Ilja Moshnikov","",""
"UT101","Can the marking of the possessor in the attributive construction vary?",0,"Ilja Moshnikov","",""
"UT102","Can the possessor in the attributive construction be marked with the nominative?",0,"Ilja Moshnikov","","Possessor is marked with the genitive."
"UT103","Is non-singular possession marked in the possessive declension?",0,"Ilja Moshnikov","",""
"UT104","Can 2Sg possessive suffix be used to mark definiteness? ",0,"Ilja Moshnikov","",""
"UT105","Can 3Sg possessive suffix be used to mark definiteness? ",0,"Ilja Moshnikov","",""
"UT106","Is there animacy distinction in independent interrogative pronouns?",1,"Ilja Moshnikov","ken;;who;|mi;;what;",""
"UT107","When used as a relative pronoun, is it common to use 'who' for animates other than humans?",0,"Ilja Moshnikov","",""
"UT108","When used as a relative pronoun, is it common to use 'who' for inanimates?",0,"Ilja Moshnikov","",""
"UT109","Can a demonstrative stem be used in the function of a pronoun with 3rd person singular human referent?",0,"Ilja Moshnikov","",""
"UT110","Is the order of possessive suffix and case suffix across the paradigm the same?",1,"Ilja Moshnikov","eči-n tytär-dä-ni;look_for-1SG daugther-PRT-POSS.1SG;I'm looking for my daughter;","The possessive suffix follows the case suffix."
"UT111","Is the order of number and case suffixes fixed across the paradigm the same?",1,"Ilja Moshnikov","kaži-loi-nke;cat-PL-COM;with cats;","The order is number + case marker."
"UT112","Are there different words for mother’s brother and father’s brother?",0,"Ilja Moshnikov","",""
"UT113","Are there different words for younger and older relative for other relations than siblings?",0,"Ilja Moshnikov","",""
"UT114","Is there animacy distinction for both concepts 'new/young' and 'old'?",0,"Ilja Moshnikov","",""
"UT115","Is there distinction for both 'warm' and 'cold' based on whether referring to weather or to temperature of objects?",0,"Ilja Moshnikov","",""
"UT116","Is there contrastive length of consonants?",1,"Eva Saar","kanan [ˈka.nan] hen.GEN.SG vs. kannan [ˈkan.nan] heel.GEN.SG",""
"UT117","Is there contrastive length of vowels?",1,"Eva Saar","tuli [ˈtu.lʲiˑ] ‘fire’ vs. tuuli [ˈtuː.lʲi]  ‘wind’",""
"UT118","Is there contrast between short and long unstressed vowels?",1,"Eva Saar; KKVS","puhu [ˈpu.huˑ] 'blowing; gust' vs. puhuu [ˈpu.huː] blow.PRS.3SG",""
"UT119","Is there contrast in duration of geminate consonants?",0,"Eva Saar","",""
"UT120","Are there more than two phonological quantities? ",0,"Eva Saar","",""
"UT121","Are there extralong syllables? ",1,"Eva Saar","juokso [ˈjuok.so] 'running', juoksii [ˈjuok.siː] 'runner'",""
"UT122","Is the main foot structure trochaic?",1,"Eva Saar","kana [ˈka.naˑ] ’hen’",""
"UT123","Is there lexically distinctive word stress?",0,"Eva Saar","",""
"UT124","Is there morphologically conditioned stress?",1,"Eva Saar; KKVS","hyppeämine [ˈhyp.peæˌmi.ne] 'jumping'",""
"UT125","Is there fixed primary stress?",1,"Eva Saar","kana [ˈka.naˑ] 'hen'",""
"UT126","Is there stress in heavy syllables?",0,"Eva Saar","",""
"UT127","Is there non-initial primary stress?",0,"Eva Saar","",""
"UT128","Is there palatal vowel harmony?",1,"Eva Saar; KKVS","eländy [ˈe.læn.dy] 'life', ötönöi [ˈø.tø.nøi] 'snail', väzymys [ˈvæ.zy.mys] 'tiredness'",""
"UT129","Is there velar vowel harmony?",0,"Eva Saar","",""
"UT130","Is there labial vowel harmony? ",0,"Eva Saar","",""
"UT131","Are there rising diphthongs? ",1,"Eva Saar","seiny [ˈsei.ny] 'wall'",""
"UT132","Are there lowering diphthongs?",1,"Eva Saar","ruadua [ˈrua.dua] work.INF",""
"UT133","Is there qualitative contrast between subsets of short and long vowels?",0,"Eva Saar","",""
"UT134","Are there full vs. reduced vowels as contrastive subsets? ",0,"Eva Saar","",""
"UT135","Is there front high rounded vowel ü [y]?",1,"Eva Saar","seiny [ˈsei.ny] 'wall'",""
"UT136","Is there front midhigh rounded vowel ö [ø]?",1,"Eva Saar","pöly [ˈpø.lyˑ] 'dust'",""
"UT137","Is there back high unrounded vowel ï [ɯ]?",0,"Eva Saar","",""
"UT138","Is there back midhigh unrounded vowel ë [ɤ]?",0,"Eva Saar","",""
"UT139","Is there back low round vowel [ɒ]?",0,"Eva Saar","",""
"UT140","Is there contrast between low and mid front vowels (ä [æ] vs. e [e])?",1,"Eva Saar","päre [ˈpæ.re] ‘pine splinter’, pereh [ˈpe.reh] ‘family’",""
"UT141","Are there word-initial consonant clusters?",1,"Eva Saar","klakku [ˈklak.ku] 'wisp; bunch', stauttšu [ˈstaut.t͡ʃu] 'bowl'",""
"UT142","Are there word-internal consonant clusters in syllable onset?",0,"Eva Saar","",""
"UT143","Are there consonant clusters in syllable coda?",1,"Eva Saar","hursti [ˈhurs.tʲi] '(linen) fabric, towel, carpet'",""
"UT144","Are there clusters of three or more consonants in a word between vowels?",1,"Eva Saar","hursti [ˈhurs.tʲi] '(linen) fabric, towel, carpet'  ",""
"UT145","Are there word-final clusters of three or more consonants?",0,"Eva Saar","",""
"UT146","Are there palatalized dentals? ",1,"Eva Saar","pal´l´as [ˈpalʲ.lʲas] 'naked', vil'l'u [ˈvilʲ.lʲu] 'wool'",""
"UT147","Are there palatalized labials and velars? ",0,"Eva Saar","",""
"UT148","Is there palatal stop [c]?",0,"Eva Saar","",""
"UT149","Is there palatal nasal [ɲ]?",0,"Eva Saar","",""
"UT150"," Is there palatal lateral [ʎ]?",0,"Eva Saar","",""
"UT151","Is there phonemic velar nasal [ŋ]?",0,"Eva Saar","",""
"UT152","Is there dental affricate [t͡s]?",0,"Eva Saar","",""
"UT153","Is there non-alveolar affricate (e.g. [t͡ʃ], [͡cɕ])?",1,"Eva Saar","čakku [ˈt͡ʃak.ku] 'gnat, mosquito'",""
"UT154","Is there a phonological contrast between [s] and postalveolar sibilant [ʃ]?",0,"Eva Saar","",""
"UT155","Are there voiced plosives [b, g, d]?",1,"Eva Saar","hebo [ˈhe.boˑ] 'horse'",""
"UT156","Is there glottal stop [ˀ]?",0,"Eva Saar","",""
"UT157","Is there phonological contrast between plain and labial velar consonants (e.g. [k] vs. [kʷ])?",0,"Eva Saar","",""
"UT158","Is there a constraint on word-initial r?",0,"Eva Saar","",""
"UT159","Is there laryngeal fricative [h]?",1,"Eva Saar","raha [ˈra.haˑ] 'money'",""
"UT160","Is there voiced velar fricative [ɣ]?",0,"Eva Saar","",""
"UT161","Is there voiceless velar fricative [x]?",0,"Eva Saar","",""
"UT162","Is there voiced dental fricative [ð]?",0,"Eva Saar","",""
"UT163","Is there phonemic labio-velar approximant [w]?",0,"Eva Saar","",""
"UT164","Is there voiceless labiodental fricative [f]?",0,"Eva Saar","",""
"UT165","Is there radical qualitative consonant gradation?",1,"Eva Saar","paidu [ˈpai.du] 'shirt' vs. pajjad [ˈpaj.jad] 'shirts'",""
"UT166","Is there quantitative consonant gradation?",1,"Eva Saar","sukku [ˈsuk.ku] 'stocking' vs. sukat [ˈsu.kat] 'stockings'",""
