ID,Name,Meadow.Mari,Source,Example,Comment
UT142,Are there word-internal consonant clusters in syllable onset?,1,EG 58,UT142,
UT143,Are there consonant clusters in syllable coda?,1,MED,UT143,
UT144,Are there clusters of three or more consonants in a word between vowels?,1,MED,UT144,
UT145,Are there word-final clusters of three or more consonants?,0,Jeremy Bradley (p.c. 2020),,
UT146,Are there palatalized dentals?,0,EG 22,,The palatal consonants [ʎ] and [ɲ] are frequently mislabelled as palatalized. Palatalized pronunciation under Russian influence and especially in Russian loan words does happen.
UT147,Are there palatalized labials and velars?,0,EG 22,,Only in Russian loan words among contemporary speakers.
UT148,Is there palatal stop [c]?,0,EG 22,,
UT149,Is there palatal nasal [ɲ]?,1,EG 22,UT149,
UT150,Is there palatal lateral [ʎ]?,1,EG 22,UT150,
UT151,Is there phonemic velar nasal [ŋ]?,1,Jeremy Bradley (p.c. 2020),UT151,
UT152,Is there dental affricate [t͡s]?,0,OMJ 23,,Only in Russian loan words.
UT153,"Is there non-alveolar affricate (e.g. [t͡ʃ], [͡cɕ])?",1,EG 22,,
UT154,Is there a phonological contrast between [s] and postalveolar sibilant [ʃ]?,1,EG 22,UT154,
UT155,"Are there voiced plosives [b, g, d]?",1,EG 24,,"Historically as allophones of the fricatives /β/, /γ/, /δ/ after homorganic nasals, i.e.: [mb], [ŋg], [nd]. “The historical pronunciation of these sounds is encountered only rarely today: [β] has generally been replaced by [v]; /b/ is perceived as an independent phoneme; the sounds [γ] and [δ] are mainly realized as [g] and [d] in all positions.”"
UT156,Is there glottal stop [ˀ]?,0,EG 22,UT153,
UT157,Is there phonological contrast between plain and labial velar consonants (e.g. [k] vs. [kʷ])?,0,EG 22,,
UT158,Is there a constraint on word-initial r?,0,EG 22; OMJ 26,,"It is uncommon, but not excluded. There are some words of proto-Uralic origin that have an initial r. There are some varieties in which intial r is preceded by prothetic ə, however, presumably under Chuvash indluence."
UT159,Is there laryngeal fricative [h]?,0,EG 22,,
UT160,Is there voiced velar fricative [ɣ]?,0,EG 24,,"“Historically, Mari had three voiced fricative phonemes: /β/, /γ/ and /δ/ […] The historical pronunciation of these sounds is encountered only rarely today: […] the sounds [γ] and [δ] are mainly realized as [g] and [d] in all positions.”"
UT161,Is there voiceless velar fricative [x]?,0,EG 24; OMJ 23,,Only in Russian loan words. 
UT162,Is there voiced dental fricative [ð]?,0,EG 24,,"“Historically, Mari had three voiced fricative phonemes: /β/, /γ/ and /δ/ […] The historical pronunciation of these sounds is encountered only rarely today: […] the sounds [γ] and [δ] are mainly realized as [g] and [d] in all positions.”"
UT163,Is there phonemic labio-velar approximant [w]?,1,EG 24,,"“Historically, Mari had three voiced fricative phonemes: /β/, /γ/ and /δ/ […] The historical pronunciation of these sounds is encountered only rarely today: [β] has generally been replaced by [v]”."
UT164,Is there voiceless labiodental fricative [f]?,0,OMJ 21,,Only in Russian loan words.
UT165,Is there radical qualitative consonant gradation?,0,EG 34,,"There is alternation between [t] and [d] (not marked in orthography; д is used regardless of pronunciation) that has been said to resembles consonant gradation or final consonant devoicing: кид [kit] ‘hand’, кит-лан [kit-lɑn] hand-PX1PL, кид-ем [kid-em] hand-PX1SG. However, the historical explanation here is that [d] was spirantized to [ð] between vowels, and was later replaced by [d] under Russian influence."
UT166,Is there quantitative consonant gradation?,0,Jeremy Bradley (p.c. 2020),,
