ID,Primary_Text,IPA,Analyzed,Gloss,Translation,Example_Source
UT002, Éitňź…ô inňźes…®q…ô o…£…Ďd íuk č…Ďd…®,, Éitňź…ô inňźe-s…®-q…ô o…£…Ďd íu|k č-…Ď-d…®,two brother-CR-DU learn|HAB-AOR-3PL,Two brothers are studying,Pozdeeva 2015:176
UT008-1,ňątyňźs…ĎŇč ňąt…Ď č ňą…õňźtond…ô ňąmyd…Ďn ňĆm…Ďnd…ôňąziňźle čle,,ňątyňź-s…Ď-Ňč ňąt…Ď č ňą…õňźto-nd…ô ňąmyd…Ď-n ňĆm…Ďnd…ôňąziňź-le čle,come-pst-1sg this village-ill war-gen pass-ant.cvb,I came into this village after the war had passed,Klumpp and Budzisch 2023:917
UT008-2,qw√§r…£…®n oralb√§di  qum,,qw√§r…£…®-n	oral-b√§di	qum,bear-GEN	hold-PTCP.PRS	man,the man who was held by he bear,
UT028,mńďsodi mym  końáiŇč jeŇč,,mńď-sodi	my-m	końáiŇč	jeŇč,do-PTCP:NEC	matter-1SG	many	EX,I have many thing to do (things which must be done),
UT044,akkol seroŇĄŇĄi,,akkol	sero-ŇĄ-ŇĄi,again	rain-INCH-AOR3SG,it began to rain again,
UT053,q√ľňźdiŐģ…°iŐģd…® qum,,q√ľňźdiŐģ-…°iŐģd…®	qum,be.ill-ptcp.car	person,a person who is not ill,
UT073,maňźdla …®td…®n iňźb…®gaj,,maňźd-la …®td…®n iňźb…®gaj,house-PL here small,The houses here are small,
UT143,aps.tigu,,,,feed,