ID,Name,Tundra Nenets,Source,Example,Comment,,,,,,
UT159,Is there laryngeal fricative [h]?,0,"Sven-Erik Soosaar, p.c.",,,,,,,,
UT160,Is there voiced velar fricative [ɣ]?,0,"Sven-Erik Soosaar, p.c.",,,,,,,,
UT161,Is there voiceless velar fricative [x]?,1,"Sven-Erik Soosaar, p.c.",,,,,,,,
UT162,Is there voiced dental fricative [ð]?,0,"Sven-Erik Soosaar, p.c.",,,,,,,,
UT163,Is there phonemic labio-velar approximant [w]?,1,"Sven-Erik Soosaar, p.c.",,,,,,,,
UT164,Is there voiceless labiodental fricative [f]?,0,"Sven-Erik Soosaar, p.c.",,,,,,,,
UT165,Is there radical qualitative consonant gradation?,0,"Sven-Erik Soosaar, p.c.",,,,,,,,
UT166,Is there quantitative consonant gradation?,0,"Sven-Erik Soosaar, p.c.",,,,,,,,
