ID,Primary_Text,IPA,Analyzed,Gloss,Translation,Example_Source
GB024,nagür səmuʔ,,nagür səmu-ʔ,three cap-PL,three caps,Wagner-Nagy 2019:158
GB025,əmtɨ taamə maagəlʲčətə ŋanuəmənɨ ləðujču ləðitimə bəti͡ad'əʔ,,əmtɨ taa-mə maa-gəlʲčə-tə ŋanuə-mənɨ ləðuj-ču ləði-ti-mə bəti͡ad'-ə-ʔ,this reindeer-1SG.POSS what-EMPH-ADV.ELA real-ADV be.slow-AOR.3SG be.unable-AOR-1SG.OC lead.on.a.leash-EP-CN,"My reindeer is very lazy, I am not able to pull it",Wagner-Nagy 2019:102
GB027-1,kuəd'ümu ńuə ŋonəə baŋ biiʔi͡agəj,,kuəd'ümu ńuə ŋonəə baŋ bii-ʔi͡a-gəj,man child and dog go.away-AOR-3DU,The boy and the dog went away,Wagner-Nagy 2019:326
GB027-2,mənə d'esɨmə buətu d'erutuə ŋanasanəna,,mənə d'esɨ-mə buə-tu d'eru-tuə ŋanasan-ə-na,my father-1SG.POSS speak-AOR.3SG not.know-PTCP.PRS man-EP-COM,My father and the/an unknown man are talking // My father is talking with the/an unknown man,Wagner-Nagy 2019:327
GB031-1,mii,,mii,1DU,the two of us,Wagner-Nagy 2019:106
GB031-2,tii,,tii,2DU,the two of you,Wagner-Nagy 2019:106
GB031-3,sɨti,,sɨti,3DU,the two of them,Wagner-Nagy 2019:106
GB043,makəj,,ma-kəj,tent-DU,two tents,Wagner-Nagy 2019:95
GB047,ŋońd'iʔmɨə,,ŋońd'i-ʔmɨə,go.out-AN,going out,Wagner-Nagy 2019:514
GB048,kolɨðɨsji ,,kolɨðɨ-sji ,fish-AG,professional fisherman,Wagner-Nagy 2019:516
GB049,mətubsa ,,mətu-bsa ,cut-ON,scissors,Wagner-Nagy 2019:518
GB065,turubaʔatu sʲiǝ,,turubaʔa-tu sʲiǝ,big.chimney-GEN.3SG.POSS hole,the hole of his big chimney,Wagner-Nagy 2019:317
GB070,ŋuəntaʔandə mid'iʔə hotüračü,,ŋuənta-ʔa-ndə mid'i-ʔə hotüra-čü,chief-AUG-LAT give-EP-AOR.3SG letter-ACC.PL.3SG.POSS,He gave the letter to the Tsar,Wagner-Nagy 2019:396
GB073-1,fsjo ravno nagǝtǝnuʔ ńisʲiðitǝʔ kuniʔi͡agǝlʲiči čimsʲǝʔ tǝndɨčǝ,,fsjo ravno na-gǝtǝ-nuʔ ńi-sʲiði-tǝʔ kuniʔi͡a-gǝlʲiči čimsʲǝ-ʔ tǝndɨ-čǝ,all equal near-ELA-OBL.1PL.POSS NEG.AUX-FUT.RFL-3PL.RFL where-EMPH disappear-CN that-PL.2SG.POSS,"In any case, they cannot hide from us anywhere",Wagner-Nagy 2019:109
GB073-2,təti tɨŋ nanuntuʔ kumuntuə buəðu …,,təti tɨŋ na-nu-ntuʔ kumun-tuə buəðu …,that 2PL near-ADV.LOC-OBL.1PL.POSS say.what-PTCP.PRS word,What does it mean in your language…,Wagner-Nagy 2019:110
GB075,nənsuʔə maðə na,,nənsu-ʔə mað-ə na,stop-AOR.3SG tent-EP.GEN near.ADV.LAT,He stopped near the house,Wagner-Nagy 2019:153
GB083,ńilɨd'iəm,,ńilɨ-d'iə-m,live-PST-1SG,I lived,Wagner-Nagy 2019:235
GB084,hoðətə(Ɂ)suðəm ,,hoðətə-(Ɂ)suðə-m ,write-FUT-1SG,I will write,Wagner-Nagy 2019:237
GB086-1,tuuɁəm,,tuu-Ɂə-m,come-AOR-1SG,I have arrived,Wagner-Nagy 2019:223
GB086-2,ńilɨtɨm,,ńilɨ-tɨ-m,live-AOR-1SG,I live,Wagner-Nagy 2019:224
GB091,mənə ləðɨtɨmə huurəʔ,,mənə lə-ðɨ-tɨ-mə huur-ə-ʔ,1SG can-AOR-1SG.OC find-EP-CNG,I cannot find it/him/her,Wagner-Nagy 2019:230
GB093,tə bəńd'ə mɨntəlʲiʔiči,,tə bəńd'ə mɨntəlʲi-ʔi-či,well all.ACC take.with-AOR.OC.PL-3SG.OC.PL,Well he took all (the things) away with him,Wagner-Nagy 2019:230
GB113,ŋuəgüəʔ ŋanaʔsanəj tarumtumuŋhu͡anduʔ,,ŋuə-güə-ʔ ŋanaʔsan-ə-j tarum-tu-muŋhu͡a-ndu-ʔ,entity-EMPH-PL man-EP-ACC.PL be.separated-TR-HAB-AOR-3PL,Gods separate the people,Wagner-Nagy 2019:305
GB115,tak ŋətəutəküəkətumi hoðətəbüʔətu isʲüə,,tak ŋətə-u-tə-küə-kə-tu-mi hoðə-tə-büʔə-tu i-sʲüə,so see-REC-IPFV-EMPH-ITER-AOR-1DU write-IPFV-ACT-OBL.3SG.POSS be-PST.3SG,…we met each other as she studied,Wagner-Nagy 2019:303
GB117,banuʔu͡ə anikaʔa ikəbaŋhu,,ban-u-ʔu͡ə anikaʔa i-kə-baŋhu,dog-EP-AUG big.3SG be-ITER-REP.3SG,The Dog deity usually is big!,Wagner-Nagy 2019:348
GB126,tahari͡abə təndə sʲiti bəŋgüʔtüə təiču,,tahari͡abə təndə sʲiti bəŋgüʔtüə təi-ču,now there two burrow EX-AOR.3SG,"Now, there are two burrows",Wagner-Nagy 2019:355
GB130,ńuə kundaʔa bəbətə,,ńuə kunda-ʔa bəbə-tə,child fall.asleep-AOR.3SG bed-LAT,The child fell asleep in the bed,Wagner-Nagy 2019:291
GB133,D'ajkaŋkurə kərutətu məumənɨ kəndaʔkumtu ŋimi͡aɁtɨ,,D'ajka-ŋku-rə kərutətu məu-mənɨ kənda-ʔku-mtu ŋimi͡aɁ-tɨ,Dyaiku-DIM-2SG.POSS simply.GEN earth-PROL sledge-DIM-ACC.3SG.POSS drag-AOR.3SG,Dyaiku pulls his sledge on the land,Wagner-Nagy 2019:388-389
GB134,mənə ńindɨm munəʔ sɨtɨ ńisɨðǝ tuʔ,,mənə ńin-dɨ-m mun-ə-ʔ sɨtɨ ńi-sɨðǝ tu-ʔ,1SG NEG.AUX-AOR.1SG say-EP-CN 3SG NEG.AUX-FUT.3SG come-CN,I did not say that s/he won't come,Wagner-Nagy 2019:435
GB147,"mɨǝðǝðičiŋ huturǝtǝbambum, mǝnǝ kasaʔinǝ koturuʔ",,"mɨǝðǝ-ði-čiŋ huturǝ-tǝ-bambu-m, mǝnǝ kasa-ʔi-nǝ kotu-ru-ʔ",sleigh.caravan-PL.DST-ACC.PL.3PL.POSS harness-IPFV-REP-1SG 1SG almost-AOR.RFL-1SG.RFL kill-PASS-CN,"I am ordered to harness the sleigh caravan for them, I was almost killed",Wagner-Nagy 2019:100
GB155,sjüartətu taamtu koturubtaɁa,,sjüar-tə-tu taa-mtu kotu-rubta-Ɂa,friend-LAT-OBL.3SG.POSS domestic.reindeer-ACC.3SG.POSS kill-CAUS-AOR.3SG,S/he had his/her friend kill the domestic reindeer,Wagner-Nagy 2019:306
GB184,aniʔkaʔ maðǝʔ,,aniʔka-ʔ mað-ǝʔ,big-PL tent-PL,big tents,Wagner-Nagy 2019:309
GB187,kolaɁku,,kol-aɁku,fish-DIM,little fish,Wagner-Nagy 2019:512
GB188,muŋkuɁu͡a,,muŋku-Ɂu͡a,tree-AUG,big tree,Wagner-Nagy 2019:509
GB203-1,bǝnsǝ kuhu ibahu ŋanuǝ bǝnsǝ,,bǝnsǝ kuhu i-bahu ŋanuǝ bǝnsǝ,all skin be-REP.3SG real all,"People say that he wears skin (lit. ""he's all skin"")",Wagner-Nagy 2019:315
GB203-2,"ǝiɁ, kobtu͡arbaɁaɁ bǝńd'ǝɁ hotuǝj tunsɨtɨɁ tǝ",,"ǝiɁ, kobtu͡a-rbaɁa-Ɂ bǝńd'ǝ-Ɂ hotuǝ-j tunsɨ-tɨ-Ɂ tǝ",EXCL girl-AUG-PL all-PL cheek-ACC.PL put-AOR-3PL EXCL,All the girls presented their cheeks (to be kissed),Wagner-Nagy 2019:315
GB204,mǝu d'a sǝčǝɁkiɁǝ: bǝńd'ikaɁ ńoðǝɁ heði͡atɨɁ,,mǝu d'a sǝčǝ-Ɂki-Ɂǝ: bǝńd'ika-Ɂ ńoðǝ-Ɂ heði͡a-tɨ-Ɂ,earth.GEN ALL scrutinize-RES-AOR.3SG all.of.them-PL grass-PL be.stable-AOR-3PL,S/he looked at the ground: all the grass was in its place. [i.e. where it was supposed to be],Wagner-Nagy 2019:315-316
GB250,tahari͡abə təbtə kobtu͡aj hontɨ,,tahari͡abə təbtə kobtu͡a-j hon-tɨ,now also girl-ACC.PL have-AOR.3SG,"Now, he has daughters, too",Wagner-Nagy 2019:361
GB254,təti səmaʔtu bəjkunaŋku iniʔi͡aʔkuðu təisʲüə,,təti səmaʔtu bəjku-naŋku iniʔi͡a-ʔku-ðu təi-sʲüə,this Enets old.man-DIM wife-DIM-3SG.POSS EX-PST.3SG,This old Enets had a wife,Wagner-Nagy 2019:360
GB266,sɨtɨ maküəgətətu tətirə əlɨgaɁku,,sɨtɨ ma-küə-gətə-tu təti-rə əlɨgaɁku,3SG.GEN tent-EMPH-ELA-OBL.3SG.POSS that-2SG.POSS small.3SG,This one was smaller than his tent,Wagner-Nagy 2019:391
GB304,hoðür hotəraɁa sʲüartənə,,hoðür hotə-ra-Ɂa sʲüar-tə-nə,letter write-PASS-AOR.3SG friend-LAT-OBL.1SG,The letter is written by my friend,Wagner-Nagy 2019:295
GB323-1,sʲilʲakəu maad'a koirihi͡aðɨŋ,,sʲilʲakə=u maad'a koi-ri-hi͡aðɨ-ŋ,board=EXCL why leave-PASS-INFER.RFL-2SG.RFL,"Board, why were you left here?",Wagner-Nagy 2019:276
GB323-2,ńibi͡ahɨm maagəlʲičə təðuɁ,,ńi-bi͡ahɨ-m maa-gəlʲičə təðu-Ɂ,NEG.AUX-REP-1SG what-EMPH.ACC bring-CN,It has been said that I hadn't brought anything,Wagner-Nagy 2019:280
GB326,hii ďüðɨďərďə sɨlɨ mununtəŋu,,hii ďüðɨďərďə sɨlɨ munu-ntə-ŋu,night.GEN middle.ACC who say-FUT-INTER.3SG,Who will show the middle of the night?,Wagner-Nagy 2019:384
GB327,ou tahari͡aa ŋad'aðu koid'iəd'əəðɨ təniðə ŋońd'iʔə,,ou tahari͡aa ŋad'a-ðu koi-d'iəd'əə-ðɨ təniðə ŋońd'i-ʔə,EXCL now younger.sibling-3SG.POSS leave-PTCP.PST-3SG.POSS from.here go.out-AOR.3SG,"The sister, who left here, went out",Wagner-Nagy 2019:453
GB328,tujsʲüəd'əə nɨ ŋəməbtaʔam,,tuj-sʲüəd'əə nɨ ŋəm-ə-bta-ʔa-m,come-PTCP.PST.ACC woman.ACC eat-EP-CAUS-AOR-1SG,I gave something to eat to the woman who had just arrived,Wagner-Nagy 2019:453
GB410,tənə sʲüľü-bta-Ɂa-m tənə ŋəɁ i-sʲüðə-ŋ əmnɨ i-bahu ,,tənə sʲüľü-bta-Ɂa-m tənə ŋəɁ i-sʲüðə-ŋ əmnɨ i-bahu ,you.SG.[ACC] come.to.life-CAUS-AOR-1SG you.SG shaman be-FUT-2SG here be-REP.[3SG],"I revived you, now you will be a shaman",Wagner-Nagy 2019:239
GB432,kou ďiðar,,kou ďiðar,sun.GEN ray,the sun's ray,Wagner-Nagy 2019:317
GB522,təbtə ńisɨəmə ńaagəiʔ d'indiʔ,,təbtə ńi-sɨə-mə ńaagəi-ʔ d'indi-ʔ,also NEG.AUX-PST.1SG.OC good-ADV hear-CN,I did not hear it well,Wagner-Nagy 2019:107
