ID,Feature,Value,Source,Comment,Example
GB020,Are there definite or specific articles?,0,Zaikov 2013:in passim,,
GB021,Are there indefinite or non-specific articles?,0,Zaikov 2013:in passim,,
GB022,Are there prenominal articles?,0,Zaikov 2013:in passim,,
GB023,Are there postnominal articles?,0,Zaikov 2013:in passim,,
GB024,What is the order of numeral and noun in the NP?,1,Zaikov 2013:141,Numeral comes before a noun.,GB024
GB025,What is the order of adnominal demonstrative and noun?,1,Zaikov 2013:127,Adnominal demonstrative comes before a noun.,GB025
GB026,Can adnominal property words occur discontinuously?,0,Zaikov 2013:in passim,,
GB027,Are nominal conjunction and comitative expressed by different elements?,1,"Zaikov 2013:101, 223",,"GB027-1, GB027-2"
GB028,Is there a distinction between inclusive and exclusive?,0,Zaikov 2013:121-123,,
GB030,Is there a gender distinction in phonologically independent third person pronouns?,0,Zaikov 2013:in passim,,
GB031,Is there a dual or unit augmented form (in addition to plural or augmented) for all person categories in the pronoun or person index system?,0,Sarhimaa 2022:280,,
GB035,Are there three or more distance contrasts in adnominal demonstratives?,0,Zaikov 2013126-127,,
GB036,Do adnominal demonstratives show an elevation distinction?,0,Zaikov 2013:126-127,,
GB037,Do adnominal demonstratives show a visible-nonvisible distinction?,0,Zaikov 2013:126-127,,
GB038,Are there demonstrative classifiers?,0,Zaikov 2013:in passim,,
GB039,Is there nonphonological allomorphy of noun number markers?,0,Sarhimaa 2022:277,,
GB041,Are there several nouns (more than three) which are suppletive for number?,0,Zaikov 2013:in passim,,
GB042,Is there a productive overt morphological singular marker on nouns?,0,Sarhimaa 2022:277-279,,
GB043,Is there a productive morphological dual marker on nouns?,0,Sarhimaa 2022:277,,
GB044,Is there a productive morphological plural marker on nouns?,1,"Zaikov 2013:71, 74; Sarhimaa 2022:277-279",,GB044
GB046,Is there an associative plural marker for nouns?,0,Zaikov 2013:71-75,,
GB047,Is there a productive morphological pattern for deriving an action/state noun from a verb?,1,Zaikov 2013:106,,GB047
GB048,Is there a productive morphological pattern for deriving an agent noun from a verb?,1,Zaikov 2013:107; Sarhimaa 2022:283,,GB048
GB049,Is there a productive morphological pattern for deriving an object noun from a verb?,1,Zaikov 2013:106,,GB049
GB051,Is there a noun class/gender system where masculine and feminine categories are a factor in class assignment?,0,Zaikov 2013:in passim,,
GB052,Is there a noun class/gender system where shape is a factor in class assignment?,0,Zaikov 2013:in passim,,
GB053,Is there a noun class/gender system where animacy is a factor in class assignment?,0,Zaikov 2013:in passim,,
GB054,Is there a noun class/gender system where plant status is a factor in class assignment?,0,Zaikov 2013:in passim,,
GB057,Are there numeral classifiers?,0,Zaikov 2013:in passim,,
GB058,Are there possessive classifiers?,0,Zaikov 2013:in passim,,
GB059,Is the adnominal possessive construction different for alienable and inalienable nouns?,0,Zaikov 2013:124-125,,
GB065,What is the pragmatically unmarked order of adnominal possessor and possessed noun?,1,"Zaikov 2013:78,124",,GB065
GB068,"Do property words (defined semantically as property concepts such as value, shape, age, dimension) act like verbs in predicative position?",0,Zaikov 2013:in passim,,
GB069,"Do adnominal property words (defined semantically as property concepts; value, shape, age, dimension) used attributively require the same morphological treatment as verbs?",0,Zaikov 2013:in passim,,
GB070,"Are there morphological cases for non-pronominal core arguments (i.e. S, A or P)?",1,"Zaikov 2013:75, 85",,GB070
GB071,"Are there morphological cases for phonologically independent personal pronominal core arguments (i.e. S, A or P)?",1,"Zaikov 2013:75,123",,GB071
GB072,"Are there morphological cases for oblique non-pronominal NPs (i.e. not S, A or P)?",1,"Zaikov 2013:75-76, 99",,GB072
GB073,"Are there morphological cases for phonologically independent oblique personal pronouns (i.e. not S, A or P)?",1,Zaikov 2013:121-123,,GB073
GB074,Are there prepositions?,1,Zaikov 2013:222; Sarhimaa 2022:286,,GB074
GB075,Are there postpositions?,1,Zaikov 2013:220-222; Sarhimaa 2022:286,,GB075
GB079,"Do verbs have prefixes or proclitics other than S, A or P indexes (do include indexes that also mark TAM or negation)?",0,Zaikov 2013:in passim,,
GB080,"Do verbs have suffixes or enclitics other than S, A or P indexes (do include indexes that also mark TAM or negation)?",1,Zaikov 2013:211-214; Sarhimaa 2022:279-283,,GB080
GB081,Is there productive infixation in verbs?,0,Sarhimaa 2022:279-283,,
GB082,Is there overt morphological marking of present tense on verbs?,0,Sarhimaa 2022:280,,
GB083,Is there overt morphological marking on the verb dedicated to past tense?,1,Zaikov 2013:156-160; Sarhimaa 2022:280,,GB083
GB084,Is there overt morphological marking on the verb dedicated to future tense?,0,Sarhimaa 2022:280,,
GB086,Is a morphological distinction between perfective and imperfective aspect available on verbs?,0,Zaikov 2013:146-147,,
GB089,Can the S argument be indexed by a suffix/enclitic on the verb in the simple independent clause?,1,Zaikov 2013:152; Sarhimaa 2022:280,,GB089
GB090,Can the S argument be indexed by a prefix/proclitic on the verb in the simple independent clause?,0,Sarhimaa 2022:280,,
GB091,Can the A argument be indexed by a suffix/enclitic on the verb in the simple independent clause?,1,Zaikov 2013:80,,GB091
GB092,Can the A argument be indexed by a prefix/proclitic on the verb in the simple independent clause?,0,Sarhimaa 2022:280,,
GB093,Can the P argument be indexed by a suffix/enclitic on the verb in the simple independent clause?,0,Sarhimaa 2022:280,,
GB094,Can the P argument be indexed by a prefix/proclitic on the verb in the simple independent clause?,0,Sarhimaa 2022:280,,
GB095,Are variations in marking strategies of core participants based on TAM distinctions?,0,Zaikov 2013:in passim; Sarhimaa 2022:in passim,,
GB096,Are variations in marking strategies of core participants based on verb classes?,0,Sarhimaa 2022:286-288,,
GB098,Are variations in marking strategies of core participants based on person distinctions?,0,Sarhimaa 2022:286-288,,
GB099,Is there verb suppletion for participant person?,0,Zaikov 2013:in passim,,
GB103,Can a verb have a benefactive marker (applicative marker or index)?,0,Sarhimaa 2022:279-283,,
GB104,Can a verb have an instrumental marker (applicative marker or index)?,0,Sarhimaa 2022:279-283,,
GB105,Can the recipient in a ditransitive construction be marked like the transitive patient?,0,Zaikov 2013:75-102,,
GB107,"Can standard negation be marked by an affix, clitic or modification of the verb?",0,Zaikov 2013:151-172; Sarhimaa 2022:285,,
GB108,Is there directional or locative morphological marking on verbs?,0,Sarhimaa 2022:279-283,,
GB109,Is there verb suppletion for participant number?,0,Zaikov 2013:in passim,,
GB110,Is there verb suppletion for tense or aspect?,0,Zaikov 2013:in passim,,
GB111,Are there conjugation classes?,1,"Zaikov 2013:157, 160",,GB111
GB113,Are there verbal affixes or clitics that turn intransitive verbs into transitive ones?,1,Zaikov 2013:212,,GB113
GB114,Is there a phonologically bound reflexive marker on the verb?,1,Zaikov 2013:212,,GB114
GB115,Is there a phonologically bound reciprocal marker on the verb?,0,Zaikov 2013:211-214,,
GB116,"Do verbs classify the shape, size or consistency of absolutive arguments by means of incorporated nouns, verbal affixes or suppletive verb stems?",0,Zaikov 2013:in passim,,
GB117,Is there a copula for predicate nominals?,1,Zaikov 2013:256; Sarhimaa 2022:287,,GB117
GB118,Are there serial verb constructions?,0,Zaikov 2013:in passim,,
GB119,Can mood be marked by an inflecting word (‘auxiliary verb’)?,1,Sarhimaa 2022:282-283,,
GB120,Can aspect be marked by an inflecting word (‘auxiliary verb’)?,0,Zaikov 2013:in passim; Sarhimaa 2022:in passim,,
GB121,Can tense be marked by an inflecting word (‘auxiliary verb’)?,1,Sarhimaa 2022:280,,GB121
GB122,Is verb compounding a regular process?,0,Zaikov 2013:in passim,,
GB123,Are there verb-adjunct (aka light-verb) constructions?,?,Zaikov 2013:in passim,,
GB124,Is incorporation of nouns into verbs a productive intransitivizing process?,0,Zaikov 2013:in passim,,
GB126,Is there an existential verb?,0,Zaikov 2013:in passim,,
GB127,Are different posture verbs used obligatorily depending on an inanimate locatum's shape or position (e.g. ‘to lie’ vs. ‘to stand’)?,0,Zaikov 2013:in passim,,
GB129,Is there a notably small number of verb roots in the language?,0,Zaikov 2013:in passim,,
GB130,What is the pragmatically unmarked order of S and V in intransitive clauses?,1,Zaikov 2013:146,,GB130
GB131,Is a pragmatically unmarked constituent order verb-initial for transitive clauses?,0,Sarhimaa 2022:285,,
GB132,Is a pragmatically unmarked constituent order verb-medial for transitive clauses?,1,Zaikov 2013:80; Sarhimaa 2022:285,,GB132
GB133,Is a pragmatically unmarked constituent order verb-final for transitive clauses?,0,Sarhimaa 2022:285,,
GB134,Is the order of constituents the same in main and subordinate clauses?,1,"Zaikov 2013:80, 242","However, not necessarily.","GB132, GB134"
GB135,Do clausal objects usually occur in the same position as nominal objects?,1,Torikka 2009:muistoa,,"GB135-1, GB135-2"
GB136,"Is the order of core argument (i.e. S, A, and P) constituents fixed?",0,"Zaikov 2013:75, 85",,
GB137,Can standard negation be marked clause-finally?,0,Zaikov 2013:151-172,,
GB138,Can standard negation be marked clause-initially?,1,Torikka 2009:ei,"However, further research is needed.",
GB139,Is there a difference between imperative (prohibitive) and declarative negation constructions?,1,"Zaikov 2013:153-154, 174",,"GB139-1, GB139-2"
GB140,"Is verbal predication marked by the same negator as all of the following types of predication: locational, existential and nominal?",1,"Zaikov 2013:153-154,161-163",,"GB140-1, GB140-2, GB140-3"
GB146,Is there a morpho-syntactic distinction between predicates expressing controlled versus uncontrolled events or states?,0,Zaikov 2013:in passim; Sarhimaa 2022:in passim,,
GB147,Is there a morphological passive marked on the lexical verb?,1,Sarhimaa 2022:284,,GB147
GB148,Is there a morphological antipassive marked on the lexical verb?,0,Zaikov 2013:in passim; Sarhimaa 2022:in passim,,
GB149,Is there a morphologically marked inverse on verbs?,0,Zaikov 2013:in passim; Sarhimaa 2022:in passim,,
GB150,Is there clause chaining?,0,Zaikov 2013:in passim; Sarhimaa 2022:in passim,,
GB151,Is there an overt verb marker dedicated to signaling coreference or noncoreference between the subject of one clause and an argument of an adjacent clause (‘switch reference’)?,0,Zaikov 2013:in passim; Sarhimaa 2022:in passim,,
GB152,Is there a morphologically marked distinction between simultaneous and sequential clauses?,0,Zaikov 2013:in passim; Sarhimaa 2022:in passim,,
GB155,Are causatives formed by affixes or clitics on verbs?,1,Zaikov 2013:212,,GB155
GB156,Is there a causative construction involving an element that is unmistakably grammaticalized from a verb for ‘to say’?,0,Zaikov 2013:in passim,,
GB158,Are verbs reduplicated?,0,Zaikov 2013:in passim; Sarhimaa 2022:in passim,,
GB159,Are nouns reduplicated?,0,Zaikov 2013:103-111,,
GB160,Are elements apart from verbs or nouns reduplicated?,0,Zaikov 2013:in passim; Sarhimaa 2022:in passim,,
GB165,Is there a productive morphological trial marker on nouns?,0,Sarhimaa 2022:277,,
GB166,Is there a productive morphological paucal marker on nouns?,0,Sarhimaa 2022:277,,
GB167,Is there a logophoric pronoun?,0,Zaikov 2013:in passim; Sarhimaa 2022:in passim,,
GB170,Can an adnominal property word agree with the noun in noun class/gender?,0,Zaikov 2013:in passim,,
GB171,Can an adnominal demonstrative agree with the noun in noun class/gender?,0,Zaikov 2013:in passim,,
GB172,Can an article agree with the noun in noun class/gender?,0,Zaikov 2013:in passim,,
GB177,"Can the verb carry a marker of animacy of argument, unrelated to any noun class/gender of the argument visible in the NP domain?",0,Zaikov 2013:in passim,,
GB184,Can an adnominal property word agree with the noun in number?,1,"Zaikov 2013:71, 74; Sarhimaa 2022:286",,GB044
GB185,Can an adnominal demonstrative agree with the noun in number?,1,Zaikov 2013:126-127; Sarhimaa 2022:286,,"GB185-1, GB185-2"
GB186,Can an article agree with the noun in number?,0,Zaikov 2013:in passim,There are no articles.,
GB187,Is there any productive diminutive marking on the noun (exclude marking by system of nominal classification only)?,1,Zaikov 2013:104,,"GB187-1, GB187-2, GB187-3"
GB188,Is there any productive augmentative marking on the noun (exclude marking by system of nominal classification only)?,0,Zaikov 2013:104-108,,
GB192,Is there a noun class/gender system where a noun’s phonological properties are a factor in class assignment?,0,Zaikov 2013:in passim,,
GB193,What is the order of adnominal property word and noun?,1,Zaikov 2013:112; Sarhimaa 2022:285,Adnominal property word comes before a noun.,"GB044, GB193"
GB196,Is there a masculine/feminine distinction in phonologically independent second person pronouns?,0,Zaikov 2013:in passim,,
GB197,Is there a masculine/feminine distinction in phonologically independent first person pronouns?,0,Zaikov 2013:in passim,,
GB198,Can an adnominal numeral agree with the noun in noun class/gender?,0,Zaikov 2013:in passim,,
GB203,What is the order of the adnominal collective universal quantifier (‘all’) and the noun?,1,Zaikov 2013:134; Torikka 2009:kaikki,,GB203
GB204,Do collective (‘all’) and distributive (‘every’) universal quantifiers differ in their forms or their syntactic positions?,1,Zaikov 2013:134,,"GB204-1, GB204-2"
GB250,Can predicative possession be expressed with a transitive ‘habeo’ verb?,0,Torikka 2009:omistoa,,
GB252,Can predicative possession be expressed with an S-like possessum and a locative-coded possessor?,1,Zaikov 2013:96-97,The syncretic adessive-allative case has both locational and dative functions.,GB252 
GB253,Can predicative possession be expressed with an S-like possessum and a dative-coded possessor?,0,Zaikov 2013:96-97,,
GB254,Can predicative possession be expressed with an S-like possessum and a possessor that is coded like an adnominal possessor?,0,Zaikov 2013:in passim; Sarhimaa 2022:in passim,,
GB256,Can predicative possession be expressed with a comitative/conjunctional construction?,0,Zaikov 2013:in passim; Sarhimaa 2022:in passim,,
GB257,Can polar interrogation be marked by intonation only?,?,Atte Huhtala (p.c. 2026),Studies and descriptions not sufficient.,
GB260,Can polar interrogation be indicated by a special word order?,1,Atte Huhtala (p.c. 2026),At least sporadic examples can be found.,"GB260-1, GB260-2"
GB262,Is there a clause-initial polar interrogative particle?,0,Zaikov 2013:226,,
GB263,Is there a clause-final polar interrogative particle?,0,Zaikov 2013:226,,
GB264,Is there a polar interrogative particle that most commonly occurs neither clause-initially nor clause-finally?,1,Zaikov 2013:226,,GB264
GB265,"Is there a comparative construction that includes a form that elsewhere means ‘surpass, exceed’?",0,Zaikov 2013:114-115,,
GB266,Is there a comparative construction that employs a marker of the standard which elsewhere has a locational meaning?,0,Zaikov 2013:114-115,,
GB270,Can comparatives be expressed using two conjoined clauses?,0,Zaikov 2013:in passim; Sarhimaa 2022:in passim,,
GB273,Is there a comparative construction with a standard marker that elsewhere has neither a locational meaning nor a ‘surpass/exceed’ meaning?,1,Zaikov 2013:114-115,,GB273
GB275,Is there a bound comparative degree marker on the property word in a comparative construction?,1,Zaikov 2013:114; Sarhimaa 2022:278,,GB275
GB276,Is there a non-bound comparative degree marker modifying the property word in a comparative construction?,0,Zaikov 2013:in passim; Sarhimaa 2022:in passim,,
GB285,Can polar interrogation be marked by a question particle and verbal morphology?,0,Zaikov 2013:in passim; Sarhimaa 2022:in passim,,
GB286,Can polar interrogation be indicated by overt verbal morphology only?,0,Zaikov 2013:in passim; Sarhimaa 2022:in passim,,
GB291,Can polar interrogation be marked by tone?,0,Zaikov 2013:in passim; Sarhimaa 2022:in passim,,
GB296,Is there a phonologically or morphosyntactically definable class of ideophones that includes ideophones depicting imagery beyond sound?,0,Zaikov 2013:in passim; Sarhimaa 2022:in passim,,
GB297,Can polar interrogation be indicated by a V-not-V construction?,0,Zaikov 2013:in passim; Sarhimaa 2022:in passim,,
GB298,Can standard negation be marked by an inflecting word (‘auxiliary verb’)?,1,Zaikov 2013:153-154; Sarhimaa 2022:285,,GB139-1
GB299,Can standard negation be marked by a non-inflecting word (‘auxiliary particle’)?,0,Sarhimaa 2022:285,,
GB300,Does the verb for ‘give’ have suppletive verb forms?,0,Torikka 2009:antoa,,
GB301,Is there an inclusory construction?,1,Torikka 2009:kera,,"GB301-1, GB301-2"
GB302,Is there a phonologically free passive marker (‘particle’ or ‘auxiliary’)?,0,Zaikov 2013:in passim; Sarhimaa 2022:in passim,,
GB303,Is there a phonologically free antipassive marker (‘particle’ or ‘auxiliary’)?,0,Zaikov 2013:in passim; Sarhimaa 2022:in passim,,
GB304,Can the agent be expressed overtly in a passive clause?,0,Zaikov 2013:in passim; Sarhimaa 2022:in passim,,
GB305,Is there a phonologically independent reflexive marker?,1,Zaikov 2013:138,,GB305
GB306,Is there a phonologically independent reciprocal marker that does not consist of two quantifiers (e.g. each + other; two + two)?,1,Torikka 2009:toine,,GB306
GB309,"Are there multiple past or multiple future tenses, distinguishing distance from Time of Reference?",0,Sarhimaa 2022:280-283,,
GB312,Is there overt morphological marking on the verb dedicated to mood?,1,Sarhimaa 2022:280,There are four moods.,"GB312-1, GB312-2"
GB313,Are there special adnominal possessive pronouns that are not formed by an otherwise regular process?,0,"Zaikov 2013:in passim, Sarhimaa 2022:in passim",,
GB314,Can augmentative meaning be expressed productively by a shift of noun class/gender?,0,Zaikov 2013:in passim,,
GB315,Can diminutive meaning be expressed productively by a shift of noun class/gender?,0,Zaikov 2013:in passim,,
GB316,Is singular number regularly marked in the noun phrase by a phonologically free element?,0,Sarhimaa 2022:277,,
GB317,Is dual number regularly marked in the noun phrase by a phonologically free element?,0,Sarhimaa 2022:277,There is no dual.,
GB318,Is plural number regularly marked in the noun phrase by a phonologically free element?,0,Sarhimaa 2022:277,,
GB319,Is trial number regularly marked in the noun phrase by a phonologically free element?,0,Sarhimaa 2022:277,There is no trial.,
GB320,Is paucal number regularly marked in the noun phrase by a phonologically free element?,0,Sarhimaa 2022:277,There is no paucal.,
GB321,Is there a large class of nouns whose noun class/gender is not phonologically or semantically predictable?,0,Zaikov 2013:in passim,,
GB322,Is there grammatical marking of direct evidence (perceived with the senses)?,0,Zaikov 2013:in passim,,
GB323,"Is there grammatical marking of indirect evidence (hearsay, inference, etc.)?",0,Zaikov 2013:172-187,,
GB324,"Is there an interrogative verb for content interrogatives (who?, what?, etc.)?",0,Zaikov 2013:in passim; Sarhimaa 2022:in passim,,
GB325,Is there a count/mass distinction in interrogative quantifiers?,1,"Zaikov 2013:134, 216",,"GB325-1, GB325-2"
GB326,Do (nominal) content interrogatives normally or frequently occur in situ?,0,Zaikov 2013:in passim; Sarhimaa 2022:in passim,,
GB327,Can the relative clause follow the noun?,1,Zaikov 2013:242,,GB134
GB328,Can the relative clause precede the noun?,0,Zaikov 2013:in passim; Sarhimaa 2022:in passim,,
GB329,Are there internally-headed relative clauses?,0,Zaikov 2013:in passim; Sarhimaa 2022:in passim,,
GB330,Are there correlative relative clauses?,0,Zaikov 2013:in passim; Sarhimaa 2022:in passim,,
GB331,Are there non-adjacent relative clauses?,0,Zaikov 2013:in passim; Sarhimaa 2022:in passim,Further research required.,
GB333,Is there a decimal numeral system?,1,Zaikov 2013:142-143,,GB333
GB334,Is there synchronic evidence for any element of a quinary numeral system?,0,Zaikov 2013:142-143,,
GB335,Is there synchronic evidence for any element of a vigesimal numeral system?,0,Zaikov 2013:142-143,,
GB336,Is there a body-part tallying system?,0,Zaikov 2013:in passim; Sarhimaa 2022:in passim,,
GB400,"Are all person categories neutralized in some voice, tense, aspect, mood and/or negation?",0,Zaikov 2013:in passim; Sarhimaa 2022:in passim,,
GB401,Is there a class of patient-labile verbs?,0,Zaikov 2013:in passim; Sarhimaa 2022:in passim,,
GB402,Does the verb for ‘see’ have suppletive verb forms?,0,Torikka 2009:nähä,,
GB403,Does the verb for ‘come’ have suppletive verb forms?,0,Torikka 2009:tulla,,
GB408,Is there any accusative alignment of flagging?,1,Sarhimaa 2022:285-288,,"GB408-1, GB408-2"
GB409,Is there any ergative alignment of flagging?,0,Sarhimaa 2022:285-288,,
GB410,Is there any neutral alignment of flagging?,0,Sarhimaa 2022:285-288,,
GB415,Is there a politeness distinction in second person forms?,0,Torikka 2009:työ2 pers.pron. ,,
GB421,Is there a preposed complementizer for complements of verbs of thinking and/or knowing?,1,Torikka 2009:tieteä,,GB421
GB422,Is there a postposed complementizer for complements of verbs of thinking and/or knowing?,0,Zaikov 2013:in passim; Sarhimaa 2022:in passim,,
GB430,Can adnominal possession be marked by a prefix on the possessor?,0,Zaikov 2013:78; Sarhimaa 2022: 278-279,,
GB431,Can adnominal possession be marked by a prefix on the possessed noun?,0,Zaikov 2013:124-125; Sarhimaa 2022: 278-279,,
GB432,Can adnominal possession be marked by a suffix on the possessor?,1,Zaikov 2013:78; Sarhimaa 2022: 278,The possessor noun is in the genitive case.,GB432
GB433,Can adnominal possession be marked by a suffix on the possessed noun?,1,Zaikov 2013:124-125; Sarhimaa 2022: 278-279,"However, no possessive suffixes with 1Pl and 2Pl.",GB433
GB519,Can mood be marked by a non-inflecting word ('auxiliary particle')?,0,Sarhimaa 2022:281,"Following the Russian model, anna 'give, let' may be used.",
GB520,Can aspect be marked by a non-inflecting word (‘auxiliary particle’)?,0,Zaikov 2013:in passim; Sarhimaa 2022:in passim,,
GB521,Can tense be marked by a non-inflecting word (‘auxiliary particle’)?,0,Sarhimaa 2022:280-283,,
GB522,Can the S or A argument be omitted from a pragmatically unmarked clause when the referent is inferable from context ('pro-drop')?,1,Zaikov 2013:171,"With the 3rd person plural verb forms, omitting the subject results in a passive reading.","GB522-1, GB522-2"
