ID,Primary_Text,IPA,Analyzed,Gloss,Translation,Example_Source
GB024,rükä põimõ katś nädälit piä,,rükä põim-õ katś nädäli-t piä,rye.PRT harvest-PST.1PL two week-PRT almost+E2:E65,We harvested the rye for almost two weeks,Keem and Käsi 2002:143
GB025,üüse saimiq tuu lehe ja kirä,,üüse sa-i-miq tuu lehe ja kirä,night.INS get-PST-1PL DEM.DIST newspaper.GEN and letter.GEN,We got that newspaper and a letter at night,Keem and Käsi 2002:193
GB027-1,mul tütär ja poig mõistsõva saksa kiilt,,mu-l tütär ja poig mõist-sõ-va saksa kiil-t,1SG-ADE daughter and son understand-PST-3PL German language-PRT,My daughter and son spoke German,Keem and Käsi 2002:194
GB027-2,"timä oll' säärendäne, lätsivä mino imäga laada mano lõuna aigo eläjile ette anma",,"timä oll' säärendäne, lät-si-vä mino imä-ga laada mano lõuna aigo eläj-i-le ette an-ma",3SG be.PST.3SG such go-PST-3PL 1SG.GEN mother-COM stall towards noon time animal-PL-ALL front give-INF2,"She was like that, at noon they went to the stall with my mother to give food for the animals",Keem and Käsi 2002:158
GB035-1,ja kae ma et mis kuradi kotus seo om,,ja kae ma et mis kuradi kotus seo om,and look.1SG 1SG COMP what devil.GEN place DEM.SPKR.PROX be.3SG,And I am looking that what kind of place is this,Keem and Käsi 2002:280
GB035-2,"taad ei tohiq süvväq, taa aasõ hullus",,"taa-d ei tohiq süvväq, taa aa-sõ hullu-s",DEM.ADR.PROX-PRT NEG can.CNG eat.INF1 DEM.ADR.PROX drive-REFL.3SG crazy-TRA,"This cannot be eaten, this will drive you crazy",Keem and Käsi 2002:107
GB035-3,ma olõ nännüq ka tuud järve,,ma olõ nän-nüq ka tuu-d järve,1SG be.1SG see-ACT.PST.PTCP also DEM.DIST-PRT lake.PRT,I have also seen that lake,Keem and Käsi 2002:283
GB044,mõtsaq,mɤt.saʔ,mõtsa-q,forest-PL,forests,Iva 2007:43
GB047,olõma : olõminõ,,olõ-ma : olõ-minõ,be-INF2 : be-NMLZ,"to be : being, existence",Iva 2007:70
GB048,haukma : haukja,,hauk-ma : hauk-ja ,bark-INF2 : bark-AG.NLMZ ,to bark : barker,Iva 2007:109
GB049,palama : palang,,pala-ma : pala-ng,burn-INF2 : burn-VN,to burn : fire,Faster et al. 2014:põleng
GB065,kärnäri tarõ ka kõik täüs,,kärnäri tarõ ka kõik täüs,gardener.GEN room also all full,The gardener's room was also full,Keem and Käsi 2002:218
GB070,ja sis tagajalgu peeti kinniq ja edejalgu ka peeti kinniq,,ja sis tagajalg-u pee-ti kinniq ja edejalgu ka pee-ti kinniq,and then back.leg-PL.PRT keep-IPS.PST fixed and front.leg.PL.PRT also keep-IPS.PST fixed,And then the front legs were held and the hind legs were also held,Keem and Käsi 2002:220
GB071,sis praaditi näid,,sis praadi-ti nä-i-d,then fry-IPS.PST 3PL-PL-PRT,Then they were fried,Keem and Käsi 2002:221
GB072,Uhtinõnast Piirisaardõ om nüüt uma katś kilomeetrit kõvastõ,,Uhtinõna-st Piirisaar-dõ om nüüt uma katś kilomeetri-t kõvastõ,PN-ELA PN-ILL be.3SG now about two kilometre-PRT ADV,There's at least 2 kilometres between Uhtinõna to Piirisaarõ,Keem and Käsi 2002:120
GB073,es tahaq mullõ nigu näüdädäq,,es tahaq mu-llõ nigu näüdä-däq,NEG.PST want.CNG 1SG-ALL like show-INF1,Like he didn't want to show me,Keem and Käsi 2002:272
GB074,poisś ronõ üle aia,,poiss ronõ üle aia,boy climb.PST.3SG over fence.GEN,Boy climbed over the fence,Faster et al. 2014:üle
GB075,lavva pääle,,lavva pääle,table.GEN onto,on(to) the table,Iva 2007:53
GB080,mõrahuma,,mõra-hu-ma,fissure-MOM-INF2,"to fissure in a moment, to crack in a moment",Keem and Käsi 2002:30
GB083,annit,,ann-i-t,give-PST-2SG,you gave,Iva 2007:90
GB089,käüskeles tarrõ piten,,käü-skele-s tarrõ piten,walk-FRQ-3SG room.PRT around,S/he walks around the room,Faster et al. 2014:kõndima
GB091,mi süümiq kolm kõrd päävän,,mi süü-miq kolm kõrd päävä-n,1PL eat-1PL three times day-INE,We eat three times a day,Faster et al. 2014:sööma
GB107,võta-aiq,,võta-aiq,take-NEG,Doesn’t take,Iva 2007:81
GB111-1,eläs,,elä-s,live-3SG,(S/he) lives,Iva 2007:83-84
GB111-2,tege,,tege,make.3SG,(S/he) makes,Iva 2007:83-84
GB113-1,pereq süü üten lavvan,,pereq süü üte-n lavva-n,family eat.3SG one-INE table-INE,Family eats behind one table,Faster et al. 2014:laud
GB113-2,tä süüt tsiko,,tä süü-t tsiko,3SG eat-CAUS.3SG pig.PL.PRT,S/he feeds pigs,Faster et al. 2014:söötma
GB114-1,hoidma : hoiduma,,hoid-ma : hoid-u-ma,hold-INF2 : hold-REFL-INF2,to hold : retaining,"Faster et al. 2014:hoidma, hoiduma"
GB117,seo jago om tasanõ,,seo jago om tasanõ,DEM.SPKR.PROX part be.3SG flat,This part is flat,Keem and Käsi 2002:173
GB119,Olõs ta ütsindä lännüq olõs raha kätte saanuq,,Olõ-s ta ütsindä län-nüq olõ-s raha kätte saa-nuq,be-COND 3SG alone go-ACT.PST.PTCP be-COND money.GEN hand.ILL get-ACT.PST.PTCP,"If he had gone alone, he would have got the money",Plado and Lindström and Iva 2023:415 
GB121,võta : olõ võtnuq,,võta : olõ võt-nuq,take.1SG : be.1SG take-ACT.PST.PTCP,I take: I have taken,Iva 2007:79-80
GB130,piniq nädseleseq,,pini-q nädse-le-seq,dog-PL frolick-FRQ-3PL,The dogs are frolicking,Faster et al. 2014:hullama
GB132,sõs mi tapimi tsia,,sõs mi tap-i-mi tsia,then 1PL kill-PST-1PL pig.GEN,Then we killed a pig,Keem and Käsi 2002:102
GB134,"ma tiiä, et sa võlsit mullõ",,"ma tiiä, et sa võlsi-t mu-llõ",1SG know.1SG that 2SG lie-2SG 1SG-ALL,I know you're lying to me,Faster et al. 2014:teadma
GB135,ma tiiä tuud umast elost,,ma tiiä tuu-d uma-st elo-st,1SG know.1SG DEM.DIST-PRT own-ELA life-ELA,I know it from my own life,Faster et al. 2014:kogemus
GB137,ei olõ ma säänest tennüq ei,,ei olõ ma säänes-t ten-nüq ei,NEG be.CNG 1SG such-PRT make-ACT.PST.PTCP NEG,I have not done a one like this,Pilvik and Plado and Lindström 2021
GB139-1,ei annaq,,ei annaq,NEG give.CNG,Do / does not give,Iva 2007:102
GB139-2,ärq andkuq,,ärq and-kuq,NEG.IMP give-NEG.IMP,Don't give!,Iva 2007:102
GB140-1,tõist säänest poksin ei olõq,,tõis-t sääne-st poksi-n ei olõq,other-PRT such-PRT box-INE NEG be.CNG,There is no other like him/her in boxing,Faster et al. 2014:fenomen
GB140-2,püüdjät ka inämb ei olõq,,püüd-jä-t ka inämb ei olõq,catch-AG.NMLZ-PRT too more NEG be.CNG,There is no catcher any more,Keem and Käsi 2002:122
GB140-3,sõs päält tuu ei olõ enämp lubatu,,sõs päält tuu ei olõ enämp luba-tu,then after DEM.DIST.GEN NEG be.CNG more permit-PASS.PST.PTCP,Then after that it is no longer allowed,Keem and Käsi 2002:132
GB147,"ma visada, sa visatat, tä võetas",,"ma visa-da, sa visa-ta-t, tä võe-ta-s",1SG throw-PASS.1SG 2SG throw-PASS-2SG 3SG throw-PASS-3SG,"I am being thrown, you are being thrown s/he is being thrown.",Iva 2007:100
GB155,külmetämä,,külme-tä-mä,cold-CAUS-INF2,freeze,Faster et al. 2014:külmetämä
GB184,pikil ja pümehil sügüseõdagil loemiq kamina iin raamatut,,pik-i-l ja pümeh-i-l sügüseõdag-i-l loe-miq kamina iin raamatu-t,long-PL-ADE and dark-PL-ADE autumn.evening-PL-ADE read-1PL fireplace.GEN front book-PRT,On long and dark autumn evenings we read a book in front of the fireplace,Faster et al. 2014:sügis
GB185,mille sa taad teit?,,mille sa taa-d te-i-t?,Q 2SG DEM.SPKR.PROX-PRT make-PST-2SG,Why did you do this?,Faster et al. 2014:mistarvis
GB187,mehekene,,mehe-kene,man-DIM,smallish man,Plado and Lindström and Iva 2023:402
GB193,suuŕ tarõ,,suuŕ tarõ,big room,big room,Faster et al. 2014:suur
GB203,kõik kotussõq ommaq kinniq,,kõik kotussõ-q ommaq kinniq,all place-PL be.3PL closed,All places are closed,Faster et al. 2014:kõik
GB204-1,kõik kotussõq ommaq kinniq,,kõik kotussõ-q ommaq kinniq,all place-PL be.3PL closed,All places are closed,Faster et al. 2014:kõik
GB204-2,egä aastaga,,egä aastaga,every year,every year,Faster et al. 2014:iga
GB252,tüümehel olliq tulõkimmäq rõivaq,,tüümehe-l olliq tulõkimmä-q rõiva-q,work.man-ADE be.PST.3PL fireproof-PL cloth-PL,The worker had fireproof clothes,Faster et al. 2014:tulekindel
GB260,om sul viil mõni võlśkus tagavaras?,,om su-l viil mõni võlśkus tagavara-s?,be.3SG 2SG-ADE more some trick reserve-TRA,Do you have any more tricks up your sleeve?,Faster et al. 2014:tagavara
GB262,kas seo platś om prii?,,kas seo platś om prii?,Q DEM.SPKR.PROX place be.3SG vacant,Is this place free?,Faster et al. 2014:koht
GB263,läät vällä vai?,,lää-t vällä vai?,go-2SG out.ILL Q,Are you going out?,Faster et al. 2014:või
GB266,tuu oll' mu-st nii kolm `aastakka vanõ-mb,,tuu oll' must nii kolm `aastakka vanõmb,that be.PST.3SG 1SG-ELA about three year.PRT old-CMPR,S/he was about three years older than me ,Plado and Lindström and Iva 2023:396 
GB273,minoq ommaq suurõmbaq ku tuloq,,min-o-q ommaq suurõ-mba-q ku tul-o-q,go-DN-PL be.3PL big-COMP-PL than come-DN-PL,Expences are bigger than the earnings,Faster et al. 2014:kulu
GB298-1,maq ei kõnõlõq,,maq ei kõnõlõq,1SG NEG speak.CNG,I don’t speak ,Plado and Lindström and Iva 2023:421-422
GB298-2,maq es kõnõlõq ,,maq es kõnõlõq ,1SG NEG.PST speak.CNG,I didn’t speak ,Plado and Lindström and Iva 2023:421-422
GB301,,,mi esä-ga kattõgõsi,1PL father-COM two.ADV,"the two of us, my father and I",EDC
GB302,taa väiku tüü saa pia tet-üs,,taa väiku tüü saa pia tet-tü-s,DEM small work get.3SG soon make-PASS.PST.PTCP-TRA,This small work will soon be completed,Faster et al. 2014:väike 
GB304,"om truis jäänü umale maale, mis ede-essi puult määrätü ",,"om trui-s jää-nü uma-le maa-le, mis ede-essi puult määrä-tü ",be.3SG loyal-TRA remain-ACT.PST.PTCP own-ALL land-ALL REL ancestor.PL.GEN by determine-PASS.PST.PTCP,"Every man has remained loyal to his land, as determined by his ancestors",Faster et al. 2014:puult
GB305,otś hindäle puhkusõ aos kotussõtäütjät,,otś hindä-le puhkusõ ao-s kotussõtäütjä-t,search.PST.3SG REFL-ALL vacation.GEN time-TRA replacement-PRT,S/he searched for a replacement for a vacation for her/himself,Faster et al. 2014:asendaja
GB312,annasiq,,anna-siq,give-COND,Would give,Iva 2007:94
GB323,saisõv,,saisõ-v,stand-QUOT,They say it is standing,Iva 2007:96
GB325-1,ku pall'o seo aasta liiriminejit om?,,ku pall'o seo aasta liiri-mine-j-i-t om?,how much DEM.PROX year confirmation-go-AG.NLMZ-PL-PRT be.3SG,How much people go to confirmation this year?,Faster et al. 2014:leer
GB325-2,mitu kotti kardohkit nää saiq?,,mitu kotti kardohk-i-t nää sa-i-q?,how_many bag.PRT potato-PL-PRT 3PL get-PST-3PL,How many bags of potatoes did they get?,Faster et al. 2014:mitu
GB327,"plaań, miä om olõman õnnõ paprõ pääl",,plaań miä om olõ-ma-n õnnõ paprõ pääl,plan what be.3SG be-INF2-INE only paper.GEN top,Plan that exists only on paper,Faster et al. 2014:olelema
GB400,saa es,,saa es,get.CNG NEG.PST,Did not get,Faster et al. 2014:ei
GB408-1,latsõq seiq makõtsüüki,,latsõ-q se-i-q makõ-t-süüki,child-PL eat-PST-3PL sweet-PRT-food.PRT,Children ate a dessert,Faster et al. 2014:sööma
GB408-2,latsõq mängväq välän,,latsõ-q mäng-väq välän,child-PL play-3PL outside,Children are playing outside,Faster et al. 2014:mängiväq
GB415,ma kaiba tiiq pääle,,ma kaiba tiiq pääle,1SG complain.1SG 2SG top,I will complain about you,Faster et al. 2014:kaebus
GB520,eelektri lätś ärq,,eelektri lätś ärq,electricity go.PST.3SG PTCL,The electricity went out,Faster et al. 2014:vool
GB522,toimõnd' hummogust õdaguniq aian,,toimõnd' hummogu-st õdagu-niq aia-n,work.PST.3SG morning-ELA evening-TERM garden-INE,(S/he) worked in the garden from morning till night,Faster et al. 2014:askeldama
